19080900000306," <BODY><DIV><SPAN style=""BACKGROUND: white; FONT-WEIGHT: bold"" id=494F6711-F0F2-4249-96FD-237AB773EE91 token=""label"">病例特点:</SPAN><INPUT value=注 alt=""【注释】：&#10;应当在对病史、体格检查和辅助检查进行全面分析、归纳和整理后写出本病例特征,包括阳性发现和具有鉴别诊断意义的阴性症状和体征等。"" type=submit name=1B2C470D-0BFD-46BB-B277-B3949EE50330>&nbsp;<BR>主诉：左乳局切术后17天，病理确诊左乳癌2天&nbsp;<BR>现病史：患者因“自觉左乳头溢血4天”于2019-07-23我院行左乳象限切除术，术中冰冻病理提示：(左乳病变导管及周围腺体)导管内乳头状瘤，局部导管内细胞高度增生，需待免疫组化标记进一步诊断。 2019-08-07术后石蜡病理（病理号：F2019-08007）“左乳病变导管及周围腺体”多灶中级别导管原位癌合并原位实性乳头状癌，直径0.05-0.2cm；局灶乳腺烧灼面切缘见原位癌组织累及；小灶导管内乳头状瘤。I2019-09732 肿瘤细胞：ER（90%+，染色中-强），PR（90%+，染色中-强），Her-2（0），P120（膜+），E-cadherin（+），CK5/6（-），SYN（灶+），CgA（灶+），CD56（-），Ki-67（10%+）；P63（+），Calponin（+）示肌上皮存在。冰冻石蜡不符，需进一步手术。本次为行进一步诊治，门诊拟“左乳癌局切术后”收治入院。<BR>&nbsp;&nbsp;&nbsp; 自发病以来，患者神清，精神可，睡眠胃纳可，二便正常，体重无明显增减。<BR>查体：&nbsp;&nbsp;&nbsp;双乳对称；双乳皮肤无红肿、破溃、凹陷、橘皮样变；双侧乳头等高、无凹陷、无歪斜，无乳头湿疹样改变，左乳可见手术切口，愈合可；双乳可及片状腺体增厚，双侧乳腺未及明显肿块，双腋下及双锁骨区未及明显肿大淋巴结。<BR>辅检：&nbsp;&nbsp;&nbsp;2019-07-23我院行左乳象限切除术，术中冰冻病理提示：(左乳病变导管及周围腺体)导管内乳头状瘤，局部导管内细胞高度增生，需待免疫组化标记进一步诊断。&nbsp;<BR>&nbsp;&nbsp;&nbsp;&nbsp;2019-08-07术后石蜡病理（病理号：F2019-08007）“左乳病变导管及周围腺体”多灶中级别导管原位癌合并原位实性乳头状癌，直径0.05-0.2cm；局灶乳腺烧灼面切缘见原位癌组织累及；小灶导管内乳头状瘤。I2019-09732 肿瘤细胞：ER（90%+，染色中-强），PR（90%+，染色中-强），Her-2（0），P120（膜+），E-cadherin（+），CK5/6（-），SYN（灶+），CgA（灶+），CD56（-），Ki-67（10%+）；P63（+），Calponin（+）示肌上皮存在。冰冻石蜡不符，需进一步手术。&nbsp; <BR></SPAN><SPAN style=""BACKGROUND: white; FONT-WEIGHT: bold"" id=7372676B-2C7A-44B8-AD41-B130386EF8C9 token=""label"">初步诊断:</SPAN>&nbsp;&nbsp;<SPAN style=""BACKGROUND: white; COLOR: #0000ff"" token=""island"" did=""5E2324F0-7D8A-4BAA-9F3C-B59472C16091"" sid=""7B6228E3-9DDF-4705-83B5-F9CED5A09808"" ismustinput=""true"" comment=""医学元素\自定义控件\入院诊断控件""><FONT did=""19080900002090"">1、乳房恶性肿瘤(左乳导管原位癌合并实性乳头状癌)<BR>2、高血压<BR>3、慢性乙型病毒性肝炎<BR></FONT></SPAN></DIV> <DIV><SPAN style=""BACKGROUND: white; FONT-WEIGHT: bold"" id=2751E68E-D667-40E2-9488-AC738A017EAF token=""label"">诊断依据:</SPAN><INPUT value=注 alt=""【注释】：&#10;根据病例特点，提出初步诊断和诊断依据；对诊断不明的写出鉴别诊断并进行分析；并对下一步诊治措施进行分析。"" type=submit name=F0083727-FB53-4848-A85F-ED6EB61266F8>&nbsp;<BR>1、患者女，71岁。<BR>2、主诉：左乳局切术后17天，病理确诊左乳癌2天&nbsp;。 <BR>3、查体：双乳对称；双乳皮肤无红肿、破溃、凹陷、橘皮样变；双侧乳头等高、无凹陷、无歪斜，无乳头湿疹样改变，左乳可见手术切口，愈合可；双乳可及片状腺体增厚，双侧乳腺未及明显肿块，双腋下及双锁骨区未及明显肿大淋巴结。<BR>4、辅检：&nbsp;&nbsp;&nbsp;2019-07-23我院行左乳象限切除术，术中冰冻病理提示：(左乳病变导管及周围腺体)导管内乳头状瘤，局部导管内细胞高度增生，需待免疫组化标记进一步诊断。&nbsp;<BR>&nbsp;&nbsp;&nbsp;&nbsp;2019-08-07术后石蜡病理（病理号：F2019-08007）“左乳病变导管及周围腺体”多灶中级别导管原位癌合并原位实性乳头状癌，直径0.05-0.2cm；局灶乳腺烧灼面切缘见原位癌组织累及；小灶导管内乳头状瘤。I2019-09732 肿瘤细胞：ER（90%+，染色中-强），PR（90%+，染色中-强），Her-2（0），P120（膜+），E-cadherin（+），CK5/6（-），SYN（灶+），CgA（灶+），CD56（-），Ki-67（10%+）；P63（+），Calponin（+）示肌上皮存在。冰冻石蜡不符，需进一步手术。&nbsp; </DIV> <DIV><SPAN style=""BACKGROUND: white; FONT-WEIGHT: bold"" id=362FFB0B-335F-43C1-A872-977047E8CF7D token=""label"">鉴别诊断:</SPAN><INPUT value=注 alt=""【注释】：&#10;根据病例特点，提出初步诊断和诊断依据；对诊断不明的写出鉴别诊断并进行分析；并对下一步诊治措施进行分析。"" type=submit name=DB176087-5996-40F6-9FA5-97FA151025A9>&nbsp;<SPAN style=""BACKGROUND: white"" token=""dpc"" did=""E85F56A7-DA95-4A36-9257-A7C4722456C5"" dpcid=""df962cd5-25b6-418a-aa3c-40074aa06115"" choice="""" ismultiselect=""t"">&nbsp;该患者左乳局切术后，石蜡病理示左乳导管原位癌合并原位实性乳头状癌，无需鉴别。</SPAN></DIV> <DIV><SPAN style=""BACKGROUND: white; FONT-WEIGHT: bold"" id=1E8E1D17-6A31-4E8C-92F7-E4A812F1C597 token=""label"">诊疗计划:</SPAN><INPUT value=注 alt=""【注释】：&#10;提出具体的检查及治疗措施安排。"" type=submit name=9F3D1DBA-FF83-4832-B9FD-93CEBC041761>&nbsp;1.完善术前检查，如血尿常规，肝肾功能电解质，心电图等排除手术禁忌。<BR>2.拟进一步手术治疗。</DIV> <DIV align=right>&nbsp;<SPAN style=""BACKGROUND: white; COLOR: #0000ff"" token=""island"" did=""06E15476-33D0-41F1-A539-1B4EB1AD0DF8"" sid=""05A0053C-2CBF-4F90-86FE-6281388C08E7"" ismustinput=""true"" comment=""医学元素\签名2\医师签名-首次病程记录"">  <TABLE> <TBODY> <TR></TR> <TR> <TD align=right>查房医师:</TD> <TD>TM员工名称TM </TD> <TD>签名: </TD> <TD><SPAN eSignTime=""2019-8-12 20:13:31"" employeeName=""TM员工名称TM"" employeeNumber=""00000000011940"" name=""eSign"">______</SPAN> </TD> <TD>日期:<SPAN eSignTime=""2019-8-12 20:13:31"" name=""eSignTime"">______</SPAN></TD></TR></TBODY></TABLE></SPAN></DIV></BODY>",乳腺中心首次病程记录,2019-08-09 20:13:00
19080900000306," <BODY><SPAN style=""BACKGROUND: white; COLOR: #0000ff"" token=""island"" sid=""A0B2265B-0581-40E3-9B98-92918202D803"" did=""778B83F2-F1A1-43AA-9324-1DD01D87BD61"" ismustinput=""true"" comment=""医学元素\签名\医师签名-主治医师查房"">TM员工名称TM 主治医生查房</SPAN>&nbsp;&nbsp;<BR><SPAN style=""BACKGROUND: white; FONT-WEIGHT: bold"" id=4A1E4515-F969-42C2-B484-EF751EDCEB87 token=""label"">补充的病史和体征:</SPAN>&nbsp;&nbsp;患者<SPAN style=""BACKGROUND: white; COLOR: #0000ff"" token=""term"" sid=""062C38C0-FF20-469E-BBD2-54578527EAF2"" did=""C761A32A-9762-48D7-8EC5-6C080329C4BC"" Comment=""有无"">无</SPAN>激素类食物药物服用史，<SPAN style=""BACKGROUND: white; COLOR: #0000ff"" token=""term"" sid=""062C38C0-FF20-469E-BBD2-54578527EAF2"" did=""48ACEB41-E475-4137-8069-E2410F888508"" Comment=""有无"">无</SPAN>乳腺癌家族史。<BR><SPAN style=""BACKGROUND: white; FONT-WEIGHT: bold"" id=099615C1-F9A7-4D9E-8ACC-102F72CFB614 token=""label"">诊断依据与鉴别诊断的分析:</SPAN>&nbsp;&nbsp;<BR> <DIV><SPAN style=""BACKGROUND: white"" id=52F48870-6A51-4E63-937D-B4975B5405E2 token=""label"">诊断:</SPAN>&nbsp;&nbsp;&nbsp;&nbsp;<SPAN style=""BACKGROUND: white; COLOR: #0000ff"" token=""island"" sid=""7B6228E3-9DDF-4705-83B5-F9CED5A09808"" did=""572D1DF3-E0CA-4D87-93A2-FACC5280CE05"" ismustinput=""true"" comment=""医学元素\自定义控件\入院诊断控件""><FONT did=""19080900002090"">1、乳房恶性肿瘤(左乳导管原位癌合并实性乳头状癌)<BR>2、高血压<BR>3、慢性乙型病毒性肝炎</FONT></SPAN>&nbsp;<BR> <DIV><SPAN style=""BACKGROUND: white; FONT-WEIGHT: bold"" id=FFB5C159-60FD-4553-89AF-1F87D7E2AF12 token=""label"">诊断依据：</SPAN>&nbsp;&nbsp;&nbsp;&nbsp;&nbsp;&nbsp;&nbsp;&nbsp;<BR>1、患者为老年女性。<BR>2、因左乳局切术后17天，病理确诊左乳癌2天入院。 <BR>3、体格检查：双乳对称；双乳皮肤无红肿、破溃、凹陷、橘皮样变；双侧乳头等高、无凹陷、无歪斜，无乳头湿疹样改变，左乳可见手术切口，愈合可；双乳可及片状腺体增厚，双侧乳腺未及明显肿块，双腋下及双锁骨区未及明显肿大淋巴结。<BR>4、辅检：&nbsp;&nbsp;&nbsp;2019-07-23我院行左乳象限切除术，术中冰冻病理提示：(左乳病变导管及周围腺体)导管内乳头状瘤，局部导管内细胞高度增生，需待免疫组化标记进一步诊断。&nbsp;<BR>&nbsp;&nbsp;&nbsp;&nbsp;2019-08-07术后石蜡病理（病理号：F2019-08007）“左乳病变导管及周围腺体”多灶中级别导管原位癌合并原位实性乳头状癌，直径0.05-0.2cm；局灶乳腺烧灼面切缘见原位癌组织累及；小灶导管内乳头状瘤。I2019-09732 肿瘤细胞：ER（90%+，染色中-强），PR（90%+，染色中-强），Her-2（0），P120（膜+），E-cadherin（+），CK5/6（-），SYN（灶+），CgA（灶+），CD56（-），Ki-67（10%+）；P63（+），Calponin（+）示肌上皮存在。冰冻石蜡不符，需进一步手术。&nbsp;<BR> <DIV><SPAN style=""BACKGROUND: white; FONT-WEIGHT: bold"" id=4B44DD59-91F4-4028-8173-51EDFC3E1B90 token=""label"">鉴别诊断：</SPAN>&nbsp;&nbsp;<SPAN style=""BACKGROUND:white;"" token=""dpc"" did=""14F14596-AF7B-420C-A0E9-5B4F4196C2FC"" ismultiselect=""t"" choice=""{78F8FF81-69B2-4874-8969-2919F626F7E4},{9B9F9A0A-52A6-4180-ADAE-01F718C3939B},"" dpcid=""ad6512a7-8189-4467-8ff4-9e7adfa81f79""><SPAN style=""BACKGROUND: white"" section-id=""{78F8FF81-69B2-4874-8969-2919F626F7E4}"" dpc-did=""14F14596-AF7B-420C-A0E9-5B4F4196C2FC""><STRONG>1.乳腺脂肪坏死：</STRONG>多见于有乳腺外伤史的中老年女性，乳腺包块长时间无变化或缩小。肿块质硬，边界不清，活动差，可有皮肤红肿或与皮肤粘连，针吸或切除活检有助于鉴别。该患者为<SPAN style=""BACKGROUND: white; COLOR: #0000ff"" token=""term"" sid=""0CDB7C76-435E-47F1-97A5-F1A354CF90E4"" did=""C06F6283-4E5E-4E11-B336-C632E96E8DA9"" Comment=""[0]"">71</SPAN>&nbsp;岁女性，无乳腺外伤史。其左乳局切术后，病理已明确为导管原位癌合并原位实性乳头状癌，无需鉴别。</SPAN><BR><SPAN style=""BACKGROUND: white"" section-id=""{9B9F9A0A-52A6-4180-ADAE-01F718C3939B}"" dpc-did=""14F14596-AF7B-420C-A0E9-5B4F4196C2FC""><STRONG>2.分叶状肿瘤：</STRONG>乳腺分叶状肿瘤发病TM员工名称TM在40-50岁，主要表现为无痛性单发肿块，一般进展缓慢，病程较长，部分患者肿块短期内可突然增大，肿块多位于外上象限，活动度好，边界清楚，触诊或B超可见叶状结构，肿块很大时表面皮肤可见扩TM员工名称TM脉，淋巴结转移少见。体格检查、影像学检查及细针抽吸细胞学检查均不能完全与纤维腺瘤鉴别，确诊需依靠切除活检病理。</SPAN></SPAN>&nbsp;&nbsp;该患者左乳癌局切术后，病理恶性已明确，无需鉴别。</DIV></DIV></DIV> <DIV><SPAN style=""BACKGROUND: white; FONT-WEIGHT: bold"" id=8DE292E4-F489-454A-9ACE-1BD5A07AF46B token=""label"">诊疗计划:</SPAN>&nbsp;&nbsp;&nbsp;<SPAN style=""BACKGROUND: white"" token=""dpc"" did=""23151A4D-0A62-4FE0-A2BF-FC7E4DC26B88"" ismultiselect=""f"" choice=""{BE1AA60E-86F7-4F6A-AC69-65381131A75C},"" dpcid=""e341a57e-bccd-4816-82c8-24d7a815dfea""><SPAN style=""BACKGROUND: white"" section-id=""{BE1AA60E-86F7-4F6A-AC69-65381131A75C}"" dpc-did=""23151A4D-0A62-4FE0-A2BF-FC7E4DC26B88"">1.患者已完成血常规，肝肾功能电解质血糖及尿常规，凝血功能检查，未见手术禁忌症，待患者完善术前影像学检查后决定具体治疗方案。<BR></SPAN></SPAN>&nbsp;</DIV> <DIV align=right><SPAN style=""BACKGROUND: white; COLOR: #0000ff"" token=""island"" sid=""048DB359-B116-45D3-A1CA-2A1BC752A114"" did=""862F9B22-E291-49B0-9E23-B4C5DFA97B84"" ismustinput=""true"" comment=""医学元素\签名2\医师签名-查房医师""> <TABLE> <TBODY> <TR></TR> <TR> <TD align=right>查房医师:</TD> <TD>TM员工名称TM </TD> <TD>签名: </TD> <TD><SPAN eSignTime=""2019-8-12 20:18:26"" employeeName=""TM员工名称TM"" employeeNumber=""00000000012040"" name=""eSign"">______</SPAN> </TD> <TD>日期:<SPAN eSignTime=""2019-8-12 20:18:26"" name=""eSignTime"">______</SPAN></TD></TR></TBODY></TABLE></SPAN>&nbsp;</DIV></BODY>",乳腺中心主治医师首次查房记录,2019-08-10 09:00:00
19080900000306," <BODY><SPAN style=""BACKGROUND: white; COLOR: #0000ff"" comment=""医学元素\签名\医师签名-主任医师查房"" ismustinput=""true"" sid=""76CCE431-4582-43D4-962E-1DB1BF161170"" did=""93197FC1-0671-4533-9F6F-4C8261BC9BC4"" token=""island"">TM员工名称TM 主任医生查房</SPAN>&nbsp;<BR> <DIV><SPAN style=""BACKGROUND: white; FONT-WEIGHT: bold"" id=7F175BB2-798C-4B4F-8977-E735E99DA202 token=""label"">补充病史与体征：</SPAN>&nbsp;无补充病史及体征。&nbsp;&nbsp;<BR><SPAN style=""BACKGROUND: white; FONT-WEIGHT: bold"" id=9F162270-4AAB-4025-BA31-908658E94EE6 token=""label"">对病情的分析:</SPAN>&nbsp;&nbsp;患者为年龄<SPAN style=""BACKGROUND: white; COLOR: #0000ff"" sid=""0CDB7C76-435E-47F1-97A5-F1A354CF90E4"" did=""40DEA3A1-E9C4-462A-B3DB-F1EF7AED3D5F"" token=""term"" Comment=""[0]"">71</SPAN>&nbsp;岁女性，主诉：&nbsp;左乳局切术后17天，病理确诊左乳癌2天。&nbsp;<SPAN style=""BACKGROUND:white;"" did=""833CEAFB-243E-496F-B1BE-65C153BFC733"" token=""dpc"" dpcid=""dcc462a9-e486-473a-9547-6c70b336e765"" choice=""{ED032BDB-327B-4C93-A65C-EC3D9A50387A},"" ismultiselect=""f"">该患者因左乳头溢血于我院行左乳象限切除术，术中冰冻示(左乳病变导管及周围腺体)导管内乳头状瘤，局部导管内细胞高度增生，需待免疫组化标记进一步诊断。术后石蜡病理示“左乳病变导管及周围腺体”多灶中级别导管原位癌合并原位实性乳头状癌，直径0.05-0.2cm；局灶乳腺烧灼面切缘见原位癌组织累及；小灶导管内乳头状瘤。I2019-09732 肿瘤细胞：ER（90%+，染色中-强），PR（90%+，染色中-强），Her-2（0），P120。冰冻石蜡不符，需进一步手术。&nbsp;结合患者查体、辅检及病史，考虑不具备保乳指征，需行左乳癌乳房单纯切除术+前哨淋巴结活检术备腋窝淋巴结清扫术。充分告知患者及其家属手术必要性及相关风险性，患者表示理解并同意手术。</SPAN></DIV> <DIV><SPAN style=""BACKGROUND: white; FONT-WEIGHT: bold"" id=3E6A5441-A9FB-4E90-9FAA-ED961E74CEB6 token=""label"">查体：</SPAN>&nbsp;&nbsp;双乳对称；双乳皮肤无红肿、破溃、凹陷、橘皮样变；双侧乳头等高、无凹陷、无歪斜，无乳头湿疹样改变，左乳可见手术切口，愈合可；双乳可及片状腺体增厚，双侧乳腺未及明显肿块，双腋下及双锁骨区未及明显肿大淋巴结。&nbsp;&nbsp;<BR> <DIV><SPAN style=""BACKGROUND: white; FONT-WEIGHT: bold"" id=59523073-C623-45E9-A12F-D23290EEAF30 token=""label"">入院后辅助检查：</SPAN>&nbsp;&nbsp;&nbsp;<BR>&nbsp;&nbsp;&nbsp;&nbsp;患者已完善血尿常规、肝肾功能、电解质、血糖及出凝血功能等检查，未见明显异常。<BR>&nbsp;&nbsp;&nbsp;&nbsp;2019-08-10心电图：窦性心动过缓。&nbsp;&nbsp;&nbsp;&nbsp;<BR><SPAN style=""BACKGROUND: white; FONT-WEIGHT: bold"" id=83D32159-50CE-4231-8BD3-AEFA1CB896DA token=""label"">诊疗意见:</SPAN>&nbsp;&nbsp;&nbsp;<SPAN style=""BACKGROUND: white"" did=""46F702CE-8137-43A1-9E6D-A1443F9D6378"" token=""dpc"" dpcid=""7c9a76d9-f5b4-4914-9ec8-ad9b99da5c66"" choice=""{E00BFB99-7EFC-4A0D-9353-72CA1488EFE6},"" ismultiselect=""f""><SPAN style=""BACKGROUND: white"" dpc-did=""46F702CE-8137-43A1-9E6D-A1443F9D6378"" section-id=""{E00BFB99-7EFC-4A0D-9353-72CA1488EFE6}"">1.患者术前检查基本完善，暂无手术禁忌症。<BR>2.结合患者病史、查体、辅助检查，良性可能大，但最终诊断需病理结果，须切除活检，拟下周二全麻下行左乳癌乳房单纯切除术+前哨淋巴结活检术备腋窝淋巴结清扫术。<BR>3.患者左乳癌局切术后，术中带药头孢呋辛钠静滴预防伤口感染。&nbsp;&nbsp;&nbsp;&nbsp;</SPAN></SPAN><BR></DIV></DIV> <DIV align=right>&nbsp;<SPAN style=""BACKGROUND: white; COLOR: #0000ff"" comment=""医学元素\签名2\医师签名-主任医师查房记录"" ismustinput=""true"" sid=""8C8E518D-91EB-4C1C-9E17-E92E71C4670A"" did=""37747540-EE35-44EB-B78C-30688A039D2D"" token=""island"">  <TABLE> <TBODY> <TR></TR> <TR> <TD align=right>查房医师:</TD> <TD>TM员工名称TM </TD> <TD>签名: </TD> <TD><SPAN name=""eSign"" employeeNumber=""00000000010401"" employeeName=""TM员工名称TM"" eSignTime=""2019-8-12 20:27:13"">______</SPAN> </TD> <TD>日期:<SPAN name=""eSignTime"" eSignTime=""2019-8-12 20:27:13"">______</SPAN></TD></TR></TBODY></TABLE></SPAN>&nbsp;</DIV></BODY>",乳腺中心主任医师查房记录,2019-08-11 08:26:00
19080900000306," <BODY><DIV><SPAN style=""BACKGROUND:white;; FONT-WEIGHT: bold"" id=70E5860F-A574-496D-BFAA-0AEF203D2E19 token=""label"">讨论日期:</SPAN>&nbsp;&nbsp; <SPAN style=""BACKGROUND: white; COLOR: #0000ff"" token=""island"" comment=""医学元素\自定义控件\日期控件"" ismustinput=""true"" sid=""0D407857-ADDB-421D-9A48-D18A3E3CC1B7"" did=""6D930E8A-2598-41D3-97F6-3904BE2580F2"">2019-08-13</SPAN>&nbsp; <BR><SPAN style=""BACKGROUND: white; FONT-WEIGHT: bold"" id=949B57C3-F954-4DEE-95DF-A6B84D7936BA token=""label"">参加讨论者:</SPAN>&nbsp;&nbsp; <SPAN style=""BACKGROUND: white; COLOR: #0000ff"" token=""island"" comment=""医学元素\自定义控件\参与人员"" ismustinput=""true"" sid=""283D9CD9-9DD4-4DCF-9A7C-1E6ACFA2A1DF"" did=""81F581B0-8E09-468C-A86E-18691449FCEC"">TM员工名称TM，主任医师；TM员工名称TM，主治医师；TM员工名称TM，住院医师。</SPAN>&nbsp;&nbsp;&nbsp; </DIV> <DIV><SPAN style=""BACKGROUND: white; FONT-WEIGHT: bold"" id=89B23072-F633-4F61-BE90-005EA5298106 token=""label"">病史回顾:</SPAN>&nbsp;&nbsp;患者因“自觉左乳头溢血4天”于2019-07-23我院行左乳象限切除术，术中冰冻病理提示：(左乳病变导管及周围腺体)导管内乳头状瘤，局部导管内细胞高度增生，需待免疫组化标记进一步诊断。 2019-08-07术后石蜡病理（病理号：F2019-08007）“左乳病变导管及周围腺体”多灶中级别导管原位癌合并原位实性乳头状癌，直径0.05-0.2cm；局灶乳腺烧灼面切缘见原位癌组织累及；小灶导管内乳头状瘤。I2019-09732 肿瘤细胞：ER（90%+，染色中-强），PR（90%+，染色中-强），Her-2（0），P120（膜+），E-cadherin（+），CK5/6（-），SYN（灶+），CgA（灶+），CD56（-），Ki-67（10%+）；P63（+），Calponin（+）示肌上皮存在。冰冻石蜡不符，需进一步手术。本次为行进一步诊治，门诊拟“左乳癌局切术后”收治入院。<BR>&nbsp;&nbsp;&nbsp; 自发病以来，患者神清，精神可，睡眠胃纳可，二便正常，体重无明显增减。<BR>查体：&nbsp;&nbsp;&nbsp;双乳对称；双乳皮肤无红肿、破溃、凹陷、橘皮样变；双侧乳头等高、无凹陷、无歪斜，无乳头湿疹样改变，左乳可见手术切口，愈合可；双乳可及片状腺体增厚，双侧乳腺未及明显肿块，双腋下及双锁骨区未及明显肿大淋巴结。&nbsp;</DIV> <DIV><SPAN style=""BACKGROUND: white; FONT-WEIGHT: bold"" id=5395A564-FF4F-476B-9B49-5A992EF47E9C token=""label"">手术指征:</SPAN>&nbsp;&nbsp;&nbsp;<BR>&nbsp;&nbsp;&nbsp;&nbsp;1.患者左乳局切术后，石蜡病理示恶性，具备手术指征。<BR>&nbsp;&nbsp;&nbsp;&nbsp;2.患者相关检查均已完善，排除手术禁忌。<BR>&nbsp;&nbsp;&nbsp;&nbsp;3.患者表示已充分理解手术必要性及相关风险性，并同意手术。</DIV> <DIV><SPAN style=""BACKGROUND: white; FONT-WEIGHT: bold"" id=9933EC46-08D3-4360-AA93-DA5C723BD4EA token=""label"">手术方案:</SPAN>&nbsp;&nbsp; 左乳癌乳房单纯切除术+前哨淋巴结活检术备腋窝淋巴结清扫术。是否需要分期手术：<SPAN style=""BACKGROUND: white; COLOR: #0000ff"" token=""term"" sid=""B3FB49A8-2656-4677-AC0D-24F21836C14A"" did=""7451FF27-A0AE-4BBD-A9DC-2B4A86E40F85"" Comment=""是/否"">否</SPAN>&nbsp;&nbsp;</DIV> <DIV><SPAN style=""BACKGROUND: white; FONT-WEIGHT: bold"" id=C2E8141D-36DD-4E8F-848A-8E687022D3EE token=""label"">术前准备情况:</SPAN>&nbsp;&nbsp; 一般情况可，生命体征平稳，心肺无殊，体温正常，手术禁忌症已排除，适应症明确。<BR></DIV> <DIV><SPAN style=""BACKGROUND: white; FONT-WEIGHT: bold"" id=D1328C7E-0801-4F50-85B2-B5FD1F1F5DBB token=""label"">可能出现的意外及防范措施:</SPAN>&nbsp;&nbsp; 1、出血：术中严密止血。2、感染：严格无菌操作。3、损伤周围神经及软组织：小心操作。<BR><SPAN style=""BACKGROUND: white; FONT-WEIGHT: bold"" id=EC67AA0D-5037-49E7-B490-B2DB7CB0FF26 token=""label"">具体讨论意见:</SPAN>&nbsp;&nbsp;&nbsp;<BR>&nbsp;&nbsp;&nbsp;<STRONG> <SPAN style=""COLOR: #0000ff"" token=""term"" sid=""DD7381A5-55E4-494E-B651-E060257386F9"" did=""8B914C74-5343-405F-8B60-2097AC70063E"" Comment=""医师姓名"">TM员工名称TM</SPAN></STRONG>&nbsp;<STRONG>住院医师意见</STRONG>：&nbsp;患者左乳癌局切术后，石蜡病理示恶性，冰冻石蜡不符，具备手术指征。<BR>&nbsp;&nbsp;&nbsp;<STRONG> <SPAN style=""COLOR: #0000ff"" token=""term"" sid=""DD7381A5-55E4-494E-B651-E060257386F9"" did=""30E0E2DD-08CB-4BCC-AC26-5C374293CCC2"" Comment=""医师姓名"">TM员工名称TM</SPAN></STRONG>&nbsp;<STRONG>主治医师意见</STRONG>：&nbsp;结合患者查体、辅检不具备保乳指征，予以行左乳癌乳房单纯切除术+前哨淋巴结活检术备腋窝淋巴结清扫术。<BR>&nbsp;&nbsp;&nbsp;<STRONG> <SPAN style=""COLOR: #0000ff"" token=""term"" sid=""DD7381A5-55E4-494E-B651-E060257386F9"" did=""67E5CDDF-E40A-4072-8BC1-9F3BCB3C3086"" Comment=""医师姓名"">TM员工名称TM</SPAN></STRONG>&nbsp;<STRONG>主任医师意见</STRONG>： 同意行左乳癌乳房单纯切除术+前哨淋巴结活检术备腋窝淋巴结清扫术。</DIV> <DIV><SPAN style=""BACKGROUND: white; FONT-WEIGHT: bold"" id=F8E2175E-C18A-4B17-BC72-417B1C533809 token=""label"">主持人小结意见:</SPAN>&nbsp;&nbsp;&nbsp;<SPAN style=""BACKGROUND: white; COLOR: #0000ff"" token=""term"" sid=""F2007873-1D39-41C4-8A7E-A46AC02869E4"" did=""D5565185-67AC-45AC-9723-C51929AB64AC"" Comment=""是否同意"">同意</SPAN>&nbsp;行左乳癌乳房单纯切除术+前哨淋巴结活检术备腋窝淋巴结清扫术。<BR></DIV> <DIV align=right><SPAN style=""BACKGROUND: white; COLOR: #0000ff"" token=""island"" comment=""医学元素\签名2\医师签名"" ismustinput=""true"" sid=""33D3A417-6FE1-4989-8A11-BE59F317D159"" did=""FFA598DE-D7DB-4620-BA8D-AEF9969027B0""> <TABLE> <TBODY> <TR></TR> <TR> <TD align=right>医师:</TD> <TD>TM员工名称TM </TD> <TD>签名: </TD> <TD><SPAN eSignTime=""2019-8-12 20:33:40"" employeeName=""TM员工名称TM"" employeeNumber=""00000000011940"" name=""eSign"">______</SPAN> </TD> <TD>日期:<SPAN eSignTime=""2019-8-12 20:33:40"" name=""eSignTime"">______</SPAN></TD></TR></TBODY></TABLE></SPAN></DIV></BODY>",乳腺中心术前讨论记录,2019-08-13 08:32:00
